{
  "hardness_axes": [
    {"id": "discover", "name": "Discover", "verdict": "PASS", "reasoning": "The solver must inspect code, runtime traces, generated trees, and persisted rows to find the divergence."},
    {"id": "synthesize", "name": "Synthesize", "verdict": "PASS", "reasoning": "The repair spans Go service state, persisted records, C traversal output, shell scenarios, and verifier-derived filesystem observations."},
    {"id": "diagnose", "name": "Diagnose", "verdict": "PASS", "reasoning": "The prompt reports restored-tree drift without naming replay order, identity grouping, or metadata propagation."},
    {"id": "navigate_coupling", "name": "Navigate coupling", "verdict": "PASS", "reasoning": "Changes that repair one scenario can break restart, identity, or accounting invariants elsewhere."},
    {"id": "reason_beyond_training", "name": "Reason beyond training", "verdict": "PASS", "reasoning": "The task is not a standard hardlink copy or backup script recipe; it requires restart-sensitive filesystem state reasoning."}
  ],
  "anti_trivialization_checks": [
    {"id": "disclosure_collapse", "name": "Disclosure-collapse", "verdict": "PASS", "reasoning": "The instruction can honestly state the audit outcome without revealing the internal coupling."},
    {"id": "hidden_instance", "name": "Hidden-instance", "verdict": "PASS", "reasoning": "Multiple generated profiles are checked, not a single secret corrupt artifact."},
    {"id": "single_artifact_repair", "name": "Single-artifact repair", "verdict": "PASS", "reasoning": "The planned fix requires coordinated code changes across several subsystem roots."},
    {"id": "generalization", "name": "Generalization", "verdict": "PASS", "reasoning": "Tests cover several profile combinations and require behavior that generalizes."},
    {"id": "prompt_honesty", "name": "Prompt-honesty", "verdict": "PASS", "reasoning": "A complete public contract still leaves the solver to diagnose why the service drifts."},
    {"id": "cheating_vs_difficulty", "name": "Cheating-vs-difficulty", "verdict": "PASS", "reasoning": "Difficulty rests on system reasoning, not merely on anti-tamper measures."},
    {"id": "mechanical_fix_filter", "name": "Mechanical-fix filter", "verdict": "PASS", "reasoning": "The idea is semantic and not a verifier dependency or timeout task."},
    {"id": "localized_fix", "name": "Localized-fix", "verdict": "PASS", "reasoning": "The flipping contract distributes failures so no small obvious cluster controls the suite."},
    {"id": "oracle_locality", "name": "Oracle-locality", "verdict": "PASS", "reasoning": "The oracle is planned as multi-file coordinated logic, not a whole-file replacement of one helper."},
    {"id": "small_declarative_cluster", "name": "Small declarative-cluster", "verdict": "PASS", "reasoning": "The task cannot be solved by editing one table, manifest, or config block."},
    {"id": "grep_collapse", "name": "Grep-collapse", "verdict": "PASS", "reasoning": "Instruction nouns are banned from fix-path symbols and planned test names are neutral."},
    {"id": "pre_factored_helper", "name": "Pre-factored-helper", "verdict": "PASS", "reasoning": "Fix-path function names are opaque and decoys structurally rhyme with them."},
    {"id": "recipe_discount", "name": "Recipe-discount", "verdict": "PASS", "reasoning": "A standard hardlink-preserving copy recipe is insufficient because restart and accounting interactions are tested."},
    {"id": "security_aura_discount", "name": "Security-aura discount", "verdict": "PASS", "reasoning": "The task does not rely on security flavor for perceived hardness."},
    {"id": "orthogonal_checklist", "name": "Orthogonal-checklist", "verdict": "PASS", "reasoning": "The requirements are coupled: identity, replay, and accounting fixes affect each other."},
    {"id": "harness_discount", "name": "Harness-discount", "verdict": "PASS", "reasoning": "The shell/C/Go harness provides realism but the claimed hardness is in the service semantics."},
    {"id": "one_pass_solvability", "name": "One-pass solvability", "verdict": "PASS", "reasoning": "A frontier model should need experiments and code tracing beyond opening obvious files."},
    {"id": "hard_only_gate", "name": "Hard-only gate", "verdict": "PASS", "reasoning": "The combined failure mode is clearly hard system debugging rather than medium implementation work."},
    {"id": "discovery_budget_test", "name": "Discovery budget test", "verdict": "PASS", "reasoning": "Four non-trivial discoveries are enumerated with planned locations."},
    {"id": "instruction_specificity_test", "name": "Instruction specificity test", "verdict": "PASS", "reasoning": "The planned instruction is symptoms-only and avoids cause disclosure."},
    {"id": "topology_distribution_test", "name": "Topology distribution test", "verdict": "PASS", "reasoning": "Three topologies each require at least three coordinated locations."}
  ],
  "rubric_axes": [
    {"id": "verifiable", "name": "Verifiable", "verdict": "PASS", "reasoning": "Deterministic generated workspaces and independent inspections make results programmatically checkable."},
    {"id": "well_specified", "name": "Well-specified", "verdict": "PASS", "reasoning": "The output path and equivalence contract can be stated concisely without overspecifying internals."},
    {"id": "solvable", "name": "Solvable", "verdict": "PASS", "reasoning": "An expert can repair the small Go/C system in a few hours."},
    {"id": "difficult", "name": "Difficult", "verdict": "PASS", "reasoning": "The task demands professional filesystem and service-state debugging."},
    {"id": "interesting", "name": "Interesting", "verdict": "PASS", "reasoning": "Snapshot/restore drift is operationally valuable to diagnose."},
    {"id": "outcome_verified", "name": "Outcome-verified", "verdict": "PASS", "reasoning": "Tests grade the resulting trees, records, and report rather than implementation choices."}
  ],
  "instruction_completeness_test": {
    "verdict": "PASS",
    "reasoning": "Reading only instruction.md will not reveal how persisted rows, object grouping, accounting, and C observations interact."
  },
  "discovery_budget": [
    {
      "discovery": "Persisted operations are not replayed in the same effective order after a process boundary.",
      "planned_location": "environment/internal/b1/replay.go and traces from environment/scripts/run-matrix.sh",
      "why_instruction_must_not_reveal": "Naming replay order would make the repair site and invariant obvious."
    },
    {
      "discovery": "Names and backing file identity are treated inconsistently across capture and materialization.",
      "planned_location": "environment/internal/d3/pair.go, environment/internal/a0/core.go, and environment/probe/measure.c",
      "why_instruction_must_not_reveal": "It would reduce the task to a standard hardlink-preservation recipe."
    },
    {
      "discovery": "Accounting attributes move on a different lifecycle than restored file objects.",
      "planned_location": "environment/internal/c2/roll.go and environment/internal/c2/table.go",
      "why_instruction_must_not_reveal": "It exposes the metadata propagation invariant that should be inferred from behavior."
    },
    {
      "discovery": "The C traversal helper and Go grouping code disagree on stable observations for generated cases.",
      "planned_location": "environment/probe/measure.c and environment/internal/e4/walk.go",
      "why_instruction_must_not_reveal": "It over-narrows the search to the helper boundary."
    }
  ],
  "instruction_specificity": {
    "level": "symptoms-only",
    "reasoning": "The planned prompt names the bad audit outcome and output path but does not identify causes, algorithms, files, flags, or thresholds."
  },
  "attack_path": {
    "summary": "Likely trivialization attempt: patch one replay helper or fake the report.",
    "reasoning": "The planned tests independently inspect files, records, and scenario workspaces, so a report-only or one-helper patch cannot satisfy all cases."
  },
  "smallest_plausible_patch": {
    "summary": "Coordinate persisted row folding, object grouping, accounting transfer, and traversal normalization.",
    "reasoning": "Any smaller patch should fail at least one of the clean, restart, dense, transition, or mixed scenarios."
  },
  "collapse_audit": {
    "verdict": "PASS",
    "reasoning": "The proposed construction leaves nontrivial residual work after the instruction and file tree are visible.",
    "residual_hardness": "The solver must synthesize runtime behavior across Go state, persisted records, native traversal, and verifier-derived filesystem observations.",
    "red_flags": []
  },
  "topology_enumeration": [
    {
      "id": "T1",
      "summary": "Coordinated replay/materialization path.",
      "locations": ["internal/b1/replay.go::fold_b", "internal/a0/core.go::phase_a", "internal/d3/pair.go::bind_d", "probe/measure.c::walk_e"],
      "why_no_single_location_suffices": "Ordering, grouping, metadata, and observations must all agree."
    },
    {
      "id": "T2",
      "summary": "Capture-side canonical object graph.",
      "locations": ["internal/a0/scan.go", "internal/a0/core.go::phase_a", "internal/c2/roll.go::mark_c", "internal/f5/encode.go"],
      "why_no_single_location_suffices": "Captured graph shape, encoding, and emitted records must be coordinated."
    },
    {
      "id": "T3",
      "summary": "Inspection-normalized reconciliation.",
      "locations": ["probe/measure.c::walk_e", "internal/e4/walk.go", "internal/d3/map.go", "internal/c2/table.go"],
      "why_no_single_location_suffices": "Native observations must be normalized before grouping and accounting can converge."
    }
  ],
  "construction_manifest": {
    "symbol_table": [